{
  "dataset_id": "3350ef978da3380b",
  "dataset_version": 3,
  "schema_version": 1,
  "content_hash": "905fad240a546e55912b5e26a731c9a7badd45c9fcb0b2b34862848c3d4df7a1",
  "known_as_of_utc": null,
  "adjusted": true,
  "announcement_policy": "strict",
  "universe_code": "VN30",
  "universe_as_of": "2026-08-03",
  "instruments": [
    {
      "instrument_id": "01a0a8ff-bed0-7631-8fb0-6b019677fb84",
      "ticker_at_as_of": "FPT",
      "exchange": "HOSE"
    },
    {
      "instrument_id": "01a0a8ff-bef6-7255-8f57-0d60928eb474",
      "ticker_at_as_of": "VNM",
      "exchange": "HOSE"
    },
    {
      "instrument_id": "01a0a8ff-bef8-7bb1-8515-aeec58d4230c",
      "ticker_at_as_of": "VIC",
      "exchange": "HOSE"
    },
    {
      "instrument_id": "01a0a8ff-bef9-7ce3-87f7-db0dbc1903e8",
      "ticker_at_as_of": "VHM",
      "exchange": "HOSE"
    },
    {
      "instrument_id": "01a0a8ff-befa-7a62-a7ef-296ec1a26ac2",
      "ticker_at_as_of": "VCB",
      "exchange": "HOSE"
    },
    {
      "instrument_id": "01a0a8ff-befb-7e10-a636-7e228a984e4d",
      "ticker_at_as_of": "TCB",
      "exchange": "HOSE"
    },
    {
      "instrument_id": "01a0a8ff-befc-76ee-8e5d-a71bccd87f65",
      "ticker_at_as_of": "HPG",
      "exchange": "HOSE"
    },
    {
      "instrument_id": "01a0a8ff-befc-7cbf-8f85-5d881fb93acb",
      "ticker_at_as_of": "MSN",
      "exchange": "HOSE"
    },
    {
      "instrument_id": "01a0a8ff-befd-7257-9622-18bc635fc5c1",
      "ticker_at_as_of": "MWG",
      "exchange": "HOSE"
    },
    {
      "instrument_id": "01a0a8ff-befe-7619-b1fc-121b8fe30c96",
      "ticker_at_as_of": "SSI",
      "exchange": "HOSE"
    },
    {
      "instrument_id": "01a0a8ff-bf06-7ddc-9c35-acee6ce1b2a2",
      "ticker_at_as_of": "BSR",
      "exchange": "HOSE"
    },
    {
      "instrument_id": "01a0b352-a9ea-7aea-b29a-a48bbc18eb80",
      "ticker_at_as_of": "ACB",
      "exchange": "HOSE"
    },
    {
      "instrument_id": "01a0b352-aa17-7e8a-b2ee-4a51d4fb3434",
      "ticker_at_as_of": "BID",
      "exchange": "HOSE"
    },
    {
      "instrument_id": "01a0b352-aa18-7ee9-b4bd-cdc5a2a5b2a1",
      "ticker_at_as_of": "CTG",
      "exchange": "HOSE"
    },
    {
      "instrument_id": "01a0b352-aa1a-7bf1-83b9-7a61a4ec64ed",
      "ticker_at_as_of": "GAS",
      "exchange": "HOSE"
    },
    {
      "instrument_id": "01a0b352-aa1c-7137-ae06-03750f4e65d2",
      "ticker_at_as_of": "GVR",
      "exchange": "HOSE"
    },
    {
      "instrument_id": "01a0b352-aa1d-7bde-ae78-91c7a1db16b5",
      "ticker_at_as_of": "HDB",
      "exchange": "HOSE"
    },
    {
      "instrument_id": "01a0b352-aa1e-7225-a7dc-69a99645682a",
      "ticker_at_as_of": "LPB",
      "exchange": "HOSE"
    },
    {
      "instrument_id": "01a0b352-aa20-7079-8a56-fd9c574bec96",
      "ticker_at_as_of": "MBB",
      "exchange": "HOSE"
    },
    {
      "instrument_id": "01a0b352-aa21-70c5-8ab5-f2a3de19e343",
      "ticker_at_as_of": "MCH",
      "exchange": "HOSE"
    },
    {
      "instrument_id": "01a0b352-aa2a-7adc-aee7-d05bc00a57ea",
      "ticker_at_as_of": "SAB",
      "exchange": "HOSE"
    },
    {
      "instrument_id": "01a0b352-aa2c-7c75-a491-65812b320ea5",
      "ticker_at_as_of": "SHB",
      "exchange": "HOSE"
    },
    {
      "instrument_id": "01a0b352-aa2d-77c4-b6f1-7f4e32a31fe2",
      "ticker_at_as_of": "SSB",
      "exchange": "HOSE"
    },
    {
      "instrument_id": "01a0b352-aa30-7b9c-9751-495fd460cd9f",
      "ticker_at_as_of": "STB",
      "exchange": "HOSE"
    },
    {
      "instrument_id": "01a0b352-aa32-7525-9285-04586e8793ea",
      "ticker_at_as_of": "TCX",
      "exchange": "HOSE"
    },
    {
      "instrument_id": "01a0b352-aa36-7884-8319-302130012f0f",
      "ticker_at_as_of": "VIB",
      "exchange": "HOSE"
    },
    {
      "instrument_id": "01a0b352-aa38-7106-8116-5f2ad1fa198f",
      "ticker_at_as_of": "VJC",
      "exchange": "HOSE"
    },
    {
      "instrument_id": "01a0b352-aa3b-779a-8152-b328e1563d4e",
      "ticker_at_as_of": "VPB",
      "exchange": "HOSE"
    },
    {
      "instrument_id": "01a0b352-aa3c-7cfc-9cbd-b8201d9cfe11",
      "ticker_at_as_of": "VPL",
      "exchange": "HOSE"
    },
    {
      "instrument_id": "01a0b352-aa3e-738e-bfb9-23fc83919765",
      "ticker_at_as_of": "VRE",
      "exchange": "HOSE"
    }
  ],
  "interval": "1d",
  "from_date": "2026-08-03",
  "to_date": "2026-09-17",
  "transformation_version": 1,
  "validation_version": 1,
  "adjustment_version": 2,
  "sources": [
    {
      "code": "CAFEF",
      "licence_note": "No licence granted. Retained under the absence of a prohibition rather than a permission. Not for redistribution."
    }
  ],
  "files": [
    {
      "name": "bars.parquet",
      "row_count": 930,
      "bytes": 28591,
      "sha256": "551d7f4b08b7e3f7cc9c7cc22646c12088423f5eb24768fab7e4cb2e71896e25"
    }
  ],
  "created_at_utc": "2026-09-18T07:26:10.9789812+00:00",
  "created_by_commit": "35071cab1c255e5be6258c7fcf8aa2fa2bebf736",
  "row_count": 930
}